{"build_id":{"exe_hash":"0000000000000000000000000000000000000000000000000000000000000000","game_id":"synthetic","version":"1"},"consensus_count":2,"format_version":1,"generated_at":"2026-10-25T00:00:00Z","hashes":["aaaaaaaaaaaaaaaaaaaaaaaaaaaaaaaaaaaaaaaaaaaaaaaaaaaaaaaaaaaaaaaa","bbbbbbbbbbbbbbbbbbbbbbbbbbbbbbbbbbbbbbbbbbbbbbbbbbbbbbbbbbbbbbbb"],"upload_count":3}